{
  "$schema": "https://json-schema.org/draft/2020-12/schema",
  "$id": "https://github.com/haoming-luo/agentcfd/schemas/openfoam-imported-flow-evidence.schema.json",
  "title": "AgentCFD imported-flow integration evidence 0.1",
  "type": "object",
  "required": [
    "schema", "runtime", "case", "source_sha256", "model_sha256",
    "analysis_sha256", "solver_iterations", "mesh", "flow", "portable_fields",
    "distribution", "workspace_bytes_after_publish", "accepted", "claim"
  ],
  "properties": {
    "schema": {"const": "agentcfd.openfoam-imported-flow-evidence/0.1"},
    "runtime": {"type": "string"},
    "case": {"type": "string"},
    "source_sha256": {"type": "string", "pattern": "^sha256:[0-9a-f]{64}$"},
    "model_sha256": {"type": "string", "pattern": "^[0-9a-f]{64}$"},
    "analysis_sha256": {"type": "string", "pattern": "^[0-9a-f]{64}$"},
    "solver_iterations": {"type": "integer", "minimum": 1},
    "mesh": {
      "type": "object",
      "required": ["cells", "maximum_non_orthogonality_deg", "maximum_skewness", "maximum_aspect_ratio"],
      "properties": {
        "cells": {"type": "integer", "minimum": 1},
        "maximum_non_orthogonality_deg": {"type": "number", "minimum": 0},
        "maximum_skewness": {"type": "number", "minimum": 0},
        "maximum_aspect_ratio": {"type": "number", "minimum": 1},
        "source_sha256": {"type": "string", "pattern": "^[0-9a-f]{64}$"}
      },
      "additionalProperties": false
    },
    "flow": {
      "type": "object",
      "required": ["relative_mass_imbalance", "pressure_drop_pa"],
      "properties": {
        "relative_mass_imbalance": {"type": "number", "minimum": 0},
        "pressure_drop_pa": {"type": "number"}
      },
      "additionalProperties": false
    },
    "inlet_mass_flow": {
      "type": "object",
      "required": ["requested_kg_s", "recovered_kg_s", "relative_error"],
      "properties": {
        "requested_kg_s": {"type": "number", "exclusiveMinimum": 0},
        "recovered_kg_s": {"type": "number", "exclusiveMinimum": 0},
        "relative_error": {"type": "number", "minimum": 0, "maximum": 0.0001}
      },
      "additionalProperties": false
    },
    "turbulence": {
      "type": "object",
      "required": [
        "model", "wall_treatment", "inlet_intensity",
        "inlet_length_scale_m", "inlet_kinetic_energy_m2_s2",
        "inlet_specific_dissipation_rate_s_inv"
      ],
      "properties": {
        "model": {"const": "k-omega-sst"},
        "wall_treatment": {"const": "blended-wall-functions"},
        "inlet_intensity": {"type": "number", "exclusiveMinimum": 0, "maximum": 1},
        "inlet_length_scale_m": {"type": "number", "exclusiveMinimum": 0},
        "inlet_kinetic_energy_m2_s2": {"type": "number", "exclusiveMinimum": 0},
        "inlet_specific_dissipation_rate_s_inv": {"type": "number", "exclusiveMinimum": 0}
      },
      "additionalProperties": false
    },
    "wall_y_plus": {
      "type": "object",
      "required": ["minimum", "maximum", "average", "accepted_range"],
      "properties": {
        "minimum": {"type": "number", "minimum": 0},
        "maximum": {"type": "number", "minimum": 0},
        "average": {"type": "number", "minimum": 0},
        "accepted_range": {
          "type": "array",
          "prefixItems": [{"const": 30.0}, {"const": 300.0}],
          "minItems": 2,
          "maxItems": 2
        }
      },
      "additionalProperties": false
    },
    "portable_fields": {
      "type": "object",
      "required": ["formats", "frames", "points", "bytes"],
      "properties": {
        "formats": {"type": "array", "items": {"enum": ["xdmf", "hdf5"]}, "uniqueItems": true},
        "frames": {"type": "integer", "minimum": 1},
        "points": {"type": "integer", "minimum": 1},
        "bytes": {"type": "integer", "minimum": 1},
        "verified": {"const": true}
      },
      "additionalProperties": false
    },
    "distribution": {
      "type": "object",
      "required": ["artifact", "version", "io_extra_installed"],
      "properties": {
        "artifact": {"const": "wheel"},
        "version": {"type": "string", "minLength": 1},
        "io_extra_installed": {"const": true}
      },
      "additionalProperties": false
    },
    "workspace_bytes_after_publish": {"const": 0},
    "accepted": {"const": true},
    "claim": {"const": "workflow-and-numerical-gates-not-physical-validation"}
  },
  "additionalProperties": false
}
