{
  "accepted": true,
  "analysis_sha256": "c1aee20778a2a869bb6a762191971a7d1832c7fa73fbf8930557e3fe407f9283",
  "case": "examples/imported_duct_mesh",
  "claim": "workflow-and-numerical-gates-not-physical-validation",
  "distribution": {
    "artifact": "wheel",
    "io_extra_installed": true,
    "version": "0.1.0a3"
  },
  "flow": {
    "pressure_drop_pa": 1.17882659664056,
    "relative_mass_imbalance": 1.799999011565658e-10
  },
  "mesh": {
    "cells": 6400,
    "maximum_aspect_ratio": 1.382976019,
    "maximum_non_orthogonality_deg": 15.74214263,
    "maximum_skewness": 0.1040891993,
    "source_sha256": "95c46972dfb7d9c00b1fcd44bdd9b5a9b594a1fe2d6b01ce5ae94d4dcadfd0bb"
  },
  "model_sha256": "ddb7e815dfe6af17345972a031023c12eec7e3ead837ba22dbe5e5de90f5158f",
  "portable_fields": {
    "bytes": 194533,
    "formats": ["xdmf", "hdf5"],
    "frames": 1,
    "points": 7749,
    "verified": true
  },
  "runtime": "OpenCFD v2606",
  "schema": "agentcfd.openfoam-imported-flow-evidence/0.1",
  "solver_iterations": 344,
  "source_sha256": "sha256:010c8a05cc5d0c16910ea12ef87add15cc81362790a31599411e596aff31c537",
  "workspace_bytes_after_publish": 0
}
